28,"Did the GM provide an appropriate answer or solution to your question/problem?",0.000000,0.000000,0.000000,0.000000,0.000000,0.000000,0.000000,4128894,
29,"How easy was it to understand and/or follow the information provided?",0.000000,0.000000,0.000000,0.000000,0.000000,0.000000,0.000000,4128894,
30,"Was the GM knowledgeable, respectful, and empathetic during your interactions?",0.000000,0.000000,0.000000,0.000000,0.000000,0.000000,0.000000,4128894,
31,"How would you rate the response time to address your petition?",0.000000,0.000000,0.000000,0.000000,0.000000,0.000000,0.000000,4128894,
32,"How would you rate the overall experience with the GM that assisted you with your petition?",0.000000,0.000000,0.000000,0.000000,0.000000,0.000000,0.000000,4128894,
33,"Based on your support experience, how likely is it that you would recommend WoW to others?",0.000000,0.000000,0.000000,0.000000,0.000000,0.000000,0.000000,4128894,
